{"name":"identity","displayName":"Shamoo Identity","version":"1.0.0","shamoo":{"api":"^1.0.0","runtime":"^1.0.0","manifest":1},"platforms":{"paper":{"enabled":true,"entrypoint":"dist/paper.mjs","minecraft":"1.21.x","paperApi":"1.21.x"},"velocity":{"enabled":true,"entrypoint":"dist/velocity.mjs","velocityApi":"3.x"}},"dependencies":{"required":{},"optional":{},"loadBefore":[],"loadAfter":[]},"node":{"builtins":["node:buffer"],"filesystem":{"read":["./"],"write":["./data"]},"network":false,"workers":false,"childProcess":false,"nativeAddons":false},"reload":{"watch":true,"debounceMs":500,"preserveState":true}}
